{
  "resultsPerPage": 1,
  "startIndex": 0,
  "totalResults": 1,
  "format": "NVD_CVE",
  "version": "2.0",
  "timestamp": "2026-04-08T02:27:55.449",
  "vulnerabilities": [
    {
      "cve": {
        "id": "CVE-1999-0095",
        "sourceIdentifier": "cve@mitre.org",
        "published": "1988-10-01T04:00:00.000",
        "lastModified": "2025-04-03T01:03:51.193",
        "vulnStatus": "Deferred",
        "cveTags": [],
        "descriptions": [
          {
            "lang": "en",
            "value": "The debug command in Sendmail is enabled, allowing attackers to execute commands as root."
          },
          {
            "lang": "es",
            "value": "El comando de depuración de Sendmail está activado, permitiendo a atacantes ejecutar comandos como root."
          }
        ],
        "metrics": {
          "cvssMetricV2": [
            {
              "source": "nvd@nist.gov",
              "type": "Primary",
              "cvssData": {
                "version": "2.0",
                "vectorString": "AV:N/AC:L/Au:N/C:C/I:C/A:C",
                "baseScore": 10.0,
                "accessVector": "NETWORK",
                "accessComplexity": "LOW",
                "authentication": "NONE",
                "confidentialityImpact": "COMPLETE",
                "integrityImpact": "COMPLETE",
                "availabilityImpact": "COMPLETE"
              },
              "baseSeverity": "HIGH",
              "exploitabilityScore": 10.0,
              "impactScore": 10.0,
              "acInsufInfo": false,
              "obtainAllPrivilege": true,
              "obtainUserPrivilege": false,
              "obtainOtherPrivilege": false,
              "userInteractionRequired": false
            }
          ]
        },
        "weaknesses": [
          {
            "source": "nvd@nist.gov",
            "type": "Primary",
            "description": [
              {
                "lang": "en",
                "value": "NVD-CWE-Other"
              }
            ]
          }
        ],
        "configurations": [
          {
            "nodes": [
              {
                "operator": "OR",
                "negate": false,
                "cpeMatch": [
                  {
                    "vulnerable": true,
                    "criteria": "cpe:2.3:a:eric_allman:sendmail:5.58:*:*:*:*:*:*:*",
                    "matchCriteriaId": "1D07F493-9C8D-44A4-8652-F28B46CBA27C"
                  }
                ]
              }
            ]
          }
        ],
        "references": [
          {
            "url": "http://seclists.org/fulldisclosure/2019/Jun/16",
            "source": "cve@mitre.org"
          },
          {
            "url": "http://www.openwall.com/lists/oss-security/2019/06/05/4",
            "source": "cve@mitre.org"
          },
          {
            "url": "http://www.openwall.com/lists/oss-security/2019/06/06/1",
            "source": "cve@mitre.org"
          },
          {
            "url": "http://www.osvdb.org/195",
            "source": "cve@mitre.org"
          },
          {
            "url": "http://www.securityfocus.com/bid/1",
            "source": "cve@mitre.org"
          },
          {
            "url": "http://seclists.org/fulldisclosure/2019/Jun/16",
            "source": "af854a3a-2127-422b-91ae-364da2661108"
          },
          {
            "url": "http://www.openwall.com/lists/oss-security/2019/06/05/4",
            "source": "af854a3a-2127-422b-91ae-364da2661108"
          },
          {
            "url": "http://www.openwall.com/lists/oss-security/2019/06/06/1",
            "source": "af854a3a-2127-422b-91ae-364da2661108"
          },
          {
            "url": "http://www.osvdb.org/195",
            "source": "af854a3a-2127-422b-91ae-364da2661108"
          },
          {
            "url": "http://www.securityfocus.com/bid/1",
            "source": "af854a3a-2127-422b-91ae-364da2661108"
          }
        ]
      }
    }
  ]
}
