{
  "resultsPerPage": 1,
  "startIndex": 0,
  "totalResults": 1,
  "format": "NVD_CVE",
  "version": "2.0",
  "timestamp": "2026-04-08T02:29:31.192",
  "vulnerabilities": [
    {
      "cve": {
        "id": "CVE-2017-1253",
        "sourceIdentifier": "psirt@us.ibm.com",
        "published": "2017-07-05T18:29:00.467",
        "lastModified": "2025-04-20T01:37:25.860",
        "vulnStatus": "Deferred",
        "cveTags": [],
        "descriptions": [
          {
            "lang": "en",
            "value": "IBM Security Guardium 10.0 could allow a remote authenticated attacker to execute arbitrary commands on the system. By sending a specially-crafted request, an attacker could exploit this vulnerability to execute arbitrary commands on the system. IBM X-Force ID: 124633."
          },
          {
            "lang": "es",
            "value": "IBM Security Guardium 10.0 permite a un usuario remoto autenticado ejecutar comandos aleatorios en el sistema. Mediante el envió de solicitudes especialmente manipuladas, un atacante podría ejecutar comando aleatorios en el sistema. IBM X-Force ID: 124633."
          }
        ],
        "metrics": {
          "cvssMetricV30": [
            {
              "source": "nvd@nist.gov",
              "type": "Primary",
              "cvssData": {
                "version": "3.0",
                "vectorString": "CVSS:3.0/AV:N/AC:L/PR:L/UI:N/S:C/C:H/I:H/A:H",
                "baseScore": 9.9,
                "baseSeverity": "CRITICAL",
                "attackVector": "NETWORK",
                "attackComplexity": "LOW",
                "privilegesRequired": "LOW",
                "userInteraction": "NONE",
                "scope": "CHANGED",
                "confidentialityImpact": "HIGH",
                "integrityImpact": "HIGH",
                "availabilityImpact": "HIGH"
              },
              "exploitabilityScore": 3.1,
              "impactScore": 6.0
            }
          ],
          "cvssMetricV2": [
            {
              "source": "nvd@nist.gov",
              "type": "Primary",
              "cvssData": {
                "version": "2.0",
                "vectorString": "AV:N/AC:L/Au:S/C:P/I:P/A:P",
                "baseScore": 6.5,
                "accessVector": "NETWORK",
                "accessComplexity": "LOW",
                "authentication": "SINGLE",
                "confidentialityImpact": "PARTIAL",
                "integrityImpact": "PARTIAL",
                "availabilityImpact": "PARTIAL"
              },
              "baseSeverity": "MEDIUM",
              "exploitabilityScore": 8.0,
              "impactScore": 6.4,
              "acInsufInfo": false,
              "obtainAllPrivilege": false,
              "obtainUserPrivilege": false,
              "obtainOtherPrivilege": false,
              "userInteractionRequired": false
            }
          ]
        },
        "weaknesses": [
          {
            "source": "nvd@nist.gov",
            "type": "Primary",
            "description": [
              {
                "lang": "en",
                "value": "CWE-78"
              }
            ]
          }
        ],
        "configurations": [
          {
            "nodes": [
              {
                "operator": "OR",
                "negate": false,
                "cpeMatch": [
                  {
                    "vulnerable": true,
                    "criteria": "cpe:2.3:a:ibm:security_guardium:10.0:*:*:*:*:*:*:*",
                    "matchCriteriaId": "552A0A69-388F-4842-A882-78F267D4BF09"
                  },
                  {
                    "vulnerable": true,
                    "criteria": "cpe:2.3:a:ibm:security_guardium:10.0.1:*:*:*:*:*:*:*",
                    "matchCriteriaId": "B9ACD03A-8D4C-4B94-81AB-D1BBD41E0182"
                  },
                  {
                    "vulnerable": true,
                    "criteria": "cpe:2.3:a:ibm:security_guardium:10.1:*:*:*:*:*:*:*",
                    "matchCriteriaId": "148A8443-DF7A-42AA-8D86-128CCC1D871E"
                  },
                  {
                    "vulnerable": true,
                    "criteria": "cpe:2.3:a:ibm:security_guardium:10.1.2:*:*:*:*:*:*:*",
                    "matchCriteriaId": "45E6B962-F8F8-4979-BC76-AE0B16EEB082"
                  }
                ]
              }
            ]
          }
        ],
        "references": [
          {
            "url": "http://www.ibm.com/support/docview.wss?uid=swg22004426",
            "source": "psirt@us.ibm.com",
            "tags": [
              "Vendor Advisory"
            ]
          },
          {
            "url": "http://www.securityfocus.com/bid/99372",
            "source": "psirt@us.ibm.com",
            "tags": [
              "Third Party Advisory",
              "VDB Entry"
            ]
          },
          {
            "url": "https://exchange.xforce.ibmcloud.com/vulnerabilities/124633",
            "source": "psirt@us.ibm.com",
            "tags": [
              "VDB Entry",
              "Vendor Advisory"
            ]
          },
          {
            "url": "http://www.ibm.com/support/docview.wss?uid=swg22004426",
            "source": "af854a3a-2127-422b-91ae-364da2661108",
            "tags": [
              "Vendor Advisory"
            ]
          },
          {
            "url": "http://www.securityfocus.com/bid/99372",
            "source": "af854a3a-2127-422b-91ae-364da2661108",
            "tags": [
              "Third Party Advisory",
              "VDB Entry"
            ]
          },
          {
            "url": "https://exchange.xforce.ibmcloud.com/vulnerabilities/124633",
            "source": "af854a3a-2127-422b-91ae-364da2661108",
            "tags": [
              "VDB Entry",
              "Vendor Advisory"
            ]
          }
        ]
      }
    }
  ]
}
